{
  "schema": "aisi.architecture/1",
  "layers": [
    {"id": "LAY-01", "name": "应用层（前端应用）", "order": 1, "description": "MVVM 模式 Vue.js 单页应用（SPA），前后端分离，页面跳转由 vue-router 前端路由处理", "technologies": ["Vue.js", "ElementUI", "vue-router", "axios", "JavaScript"], "modules": ["MOD-11", "MOD-12", "MOD-21", "MOD-22", "MOD-31", "MOD-32", "MOD-04", "MOD-51", "MOD-52", "MOD-53", "MOD-61", "MOD-62", "MOD-63", "MOD-07", "MOD-81", "MOD-82", "MOD-83", "MOD-84", "MOD-85", "MOD-91", "MOD-92"]},
    {"id": "LAY-02", "name": "接口层（前后端交互服务）", "order": 2, "description": "前后端仅进行数据交互：HTTP 协议接口、WebSocket 在线讯息、Excel 数据导入导出", "technologies": ["HTTP/REST", "WebSocket", "文件流（Excel）"], "modules": ["MOD-40"]},
    {"id": "LAY-03", "name": "业务逻辑层（后端服务）", "order": 3, "description": "Spring Boot 内嵌 Tomcat 承载后端业务逻辑与安全框架；基于 Servlet Filter 原理实现鉴权", "technologies": ["Java 8", "Spring Boot（IOC/MVC/ORM）", "Spring Security", "MyBatis"], "modules": ["MOD-10"]},
    {"id": "LAY-04", "name": "数据层（持久化存储）", "order": 4, "description": "MySQL 关系数据库存储；工号由数据库自动生成；RBAC 五表模型", "technologies": ["MySQL 8.0", "RBAC0 五表模型"], "modules": ["MOD-20"]}
  ],
  "services": [
    {"id": "SVC-01", "name": "RBAC 权限服务", "kind": "business", "module": "MOD-10", "api": "Spring Security 过滤器链（鉴权基于 Servlet Filter 原理，授权由系统管理员操作）", "scalability": "", "notes": "横切各业务模块；承载 REQ-005.1~005.4"},
    {"id": "SVC-02", "name": "WebSocket 在线讯息服务", "kind": "business", "module": "MOD-40", "api": "WebSocket 双向通信", "scalability": "", "notes": "支撑 MOD-07 人事通讯点对点讯息；承载 REQ-006.2"},
    {"id": "SVC-03", "name": "Excel 导入导出服务", "kind": "data", "module": "MOD-40", "api": "文件流导入导出接口", "scalability": "", "notes": "员工基本资料表批量导入导出；承载 REQ-006.3 / REQ-003.8"},
    {"id": "SVC-04", "name": "统计分析数据服务", "kind": "data", "module": "MOD-06", "api": "后端统计聚合查询", "scalability": "", "notes": "为积分条形图、人事饼图、离职柱折线图提供聚合数据（报告未明确图表库与服务实现细节，属合理推断，已降低置信）"},
    {"id": "SVC-05", "name": "MySQL 数据库服务", "kind": "data", "module": "MOD-20", "api": "MySQL 8.0", "scalability": "单机部署", "notes": "承载全部持久化数据资产（DA-01~DA-05）"}
  ],
  "data_assets": [
    {"id": "DA-01", "name": "员工主数据", "entities": ["Employee（员工）", "RewardPenalty（奖惩）", "Transfer（调动）", "Training（培训）", "Appraisal（考评）"], "store": "MySQL 8.0", "owner_module": "MOD-20", "sensitivity": "机密", "retention": "", "backup": "", "notes": "关系：员工1:N奖惩、1:N调动、1:1在训培训、1:1考评；工号自动生成、其余字段必填"},
    {"id": "DA-02", "name": "RBAC 权限数据", "entities": ["User（用户表）", "RoleMapping（角色映射表）", "Role（角色表）", "Permission（权限表）", "PermissionMapping（权限映射表）"], "store": "MySQL 8.0", "owner_module": "MOD-10", "sensitivity": "机密", "retention": "", "backup": "", "notes": "RBAC0 模型五表；业务归属 MOD-10，物理存储经 MOD-20"},
    {"id": "DA-03", "name": "薪资数据", "entities": ["SalaryAccount（工资账套：奖金/基本工资/提成）", "EmployeeAccount（员工账套设置）", "Payroll（工资表）"], "store": "MySQL 8.0", "owner_module": "MOD-05", "sensitivity": "机密", "retention": "", "backup": "", "notes": "当前套账设置；按职称/部门筛选"},
    {"id": "DA-04", "name": "统计维度数据", "entities": ["高校/职称/职位/党派/民族/学历/部门维度", "离职记录（离职率/工龄/年龄）"], "store": "MySQL 8.0", "owner_module": "MOD-06", "sensitivity": "内部", "retention": "", "backup": "", "notes": "积分分值由奖惩数据产生（依赖 DA-01）"},
    {"id": "DA-05", "name": "基础信息数据", "entities": ["Department（部门树）", "Position（职位）", "Title（职称）", "RewardRule（奖惩规则）", "PermissionGroup（权限组树）"], "store": "MySQL 8.0", "owner_module": "MOD-08", "sensitivity": "内部", "retention": "", "backup": "", "notes": "为业务模块与 RBAC 服务提供基础数据"}
  ],
  "deploy_nodes": [
    {"id": "N-01", "name": "应用服务器（ECS）", "hosts": ["SVC-01", "SVC-02", "SVC-03", "SVC-04"], "spec": "普通单核 CPU、2G RAM（原文表述 ESC，按 ECS 理解）", "protocol": "HTTP/HTTPS", "notes": "Spring Boot 内嵌 Tomcat，系统打包后整体约 38MB"},
    {"id": "N-02", "name": "数据库服务器", "hosts": ["SVC-05"], "spec": "MySQL 8.0", "protocol": "SQL/TCP", "notes": "可与 N-01 同机部署（低成本场景）"},
    {"id": "N-03", "name": "客户端浏览器", "hosts": [], "spec": "IE 8/9/10/11、Chrome、Firefox", "protocol": "HTTP/HTTPS", "notes": "SPA 前端应用运行环境；前端作为独立 Server 部署"}
  ]
}
